{
  "$schema": "https://json-schema.org/draft/2020-12/schema",
  "$id": "https://github.com/mjtechguy/blaxsmith/docs/project-file.schema.json",
  "title": "Blaxsmith project file (.blaxsmith.json), version 1",
  "description": "Committed at the repository root. Blaxsmith reads it at the project's pinned commit to suggest verification checks, setup commands, and a recipe. Suggestions are prefilled for a person to confirm; nothing is saved automatically.",
  "type": "object",
  "additionalProperties": false,
  "required": ["version"],
  "properties": {
    "$schema": { "type": "string", "maxLength": 2048 },
    "version": { "const": 1 },
    "verification": {
      "description": "Checks a run must pass, each an exact argv (no shell).",
      "type": "array",
      "maxItems": 64,
      "items": { "$ref": "#/$defs/command" }
    },
    "setup": {
      "description": "Commands that prepare a workspace, such as installing dependencies.",
      "type": "array",
      "maxItems": 16,
      "items": { "$ref": "#/$defs/command" }
    },
    "recipe": {
      "description": "Name of a library recipe to preselect for new runs.",
      "type": "string",
      "minLength": 1,
      "maxLength": 120
    }
  },
  "$defs": {
    "command": {
      "type": "object",
      "additionalProperties": false,
      "required": ["id", "command"],
      "properties": {
        "id": { "type": "string", "pattern": "^[a-z][a-z0-9_-]{0,63}$" },
        "command": {
          "type": "array",
          "minItems": 1,
          "maxItems": 32,
          "items": { "type": "string", "minLength": 1, "maxLength": 4096 }
        }
      }
    }
  }
}
